{
  "profileId": "MAIN-SKILL-SLICE",
  "version": 1,
  "appliesToLane": "MAIN",
  "scope": {
    "worktree": "branch-dev",
    "pinnedRef": "PLAN_REPO_REF",
    "writes": [
      ".claude/skills/arc-worker/scripts/*.js",
      "qa/**",
      ".ai-reports/handoffs/*.MAIN.md"
    ],
    "readOnly": [
      "**"
    ],
    "forbidden": [
      ".git/arc-runtime/** (except own claim + own mutex holders)",
      ".netlify/**",
      "netlify.toml",
      ".env*",
      "pt_*"
    ]
  },
  "capabilities": {
    "network": "none",
    "browser": "none",
    "git": "read-only",
    "deploy": "none",
    "gates": "none",
    "ownerProfile": "none"
  },
  "tools": {
    "allowed": [
      "Read",
      "Grep",
      "Glob",
      "Bash",
      "Write",
      "Edit"
    ],
    "forbidden": [
      "mcp__claude_ai_Netlify__*",
      "WebFetch",
      "WebSearch",
      "Bash(netlify *)",
      "Bash(git push*)",
      "Bash(git commit*)"
    ]
  },
  "skills": {
    "required": [
      "phase-start"
    ],
    "demandOnly": [],
    "ownerInvokedOnly": []
  },
  "phases": [
    {
      "id": "PLAN",
      "kind": "PLAN",
      "recommendedMode": "MANUAL",
      "modeCeiling": "MANUAL",
      "entryGate": "AUTHORIZED_JSON",
      "writes": [],
      "exit": "owner-approved plan (Policy v3 section A)"
    },
    {
      "id": "IMPLEMENT",
      "kind": "IMPLEMENT",
      "recommendedMode": "MANUAL",
      "modeCeiling": "MANUAL",
      "entryGate": "NONE",
      "writes": [
        ".claude/skills/arc-worker/scripts/*.js",
        "qa/**"
      ],
      "exit": "edits complete within the approved plan"
    },
    {
      "id": "VERIFY",
      "kind": "VERIFY",
      "recommendedMode": "ACCEPT_EDITS",
      "modeCeiling": "ACCEPT_EDITS",
      "entryGate": "NONE",
      "writes": [],
      "exit": "offline suites green; counts recorded"
    },
    {
      "id": "HANDOFF",
      "kind": "REPORT",
      "recommendedMode": "ACCEPT_EDITS",
      "modeCeiling": "ACCEPT_EDITS",
      "entryGate": "NONE",
      "writes": [
        ".ai-reports/handoffs/*.MAIN.md"
      ],
      "exit": "handoff registered; closeCondition evidence present"
    },
    {
      "id": "CLOSE",
      "kind": "TERMINAL",
      "recommendedMode": "MANUAL",
      "modeCeiling": "MANUAL",
      "entryGate": "NONE",
      "writes": [
        "claims/{TASK_ID}/claim.json"
      ],
      "exit": "COMPLETE written; own mutexes released (claim-protocol section 7)"
    }
  ],
  "approvalBoundaries": {
    "inside": [],
    "outside": [
      "git-stage",
      "git-commit",
      "git-push",
      "deploy",
      "env-change",
      "gate-toggle",
      "live-external-call",
      "pt-write",
      "runtime-mutation-other-claim",
      "scope-expansion",
      "production"
    ]
  },
  "verification": {
    "suites": [
      "npm run qa:offline"
    ],
    "selfTest": "targeted phase fixtures before the edit (QA-first RED), then GREEN",
    "evidence": "handoff + diff + suite counts",
    "proofStyle": "counts-not-claims"
  },
  "triggers": [
    {
      "on": "containment-breach",
      "action": "STOP"
    },
    {
      "on": "target-surface-changed",
      "action": "BLOCKED"
    },
    {
      "on": "two-failed-attempts",
      "action": "BLOCKED",
      "reason": "entry-mode-insufficient"
    },
    {
      "on": "mode-exceeds-ceiling",
      "action": "STOP-before-write"
    },
    {
      "on": "automation-increase-needed",
      "action": "STOP-request-MODE-literal"
    },
    {
      "on": "newer-artifact-observed",
      "action": "REPORT-stay-on-snapshot"
    }
  ],
  "cleanup": {
    "scratch": "scratchpad only, deleted",
    "sandbox": "n/a",
    "gates": "n/a",
    "mutexes": "release own classes at COMPLETE (claim-protocol section 7)",
    "handoff": "required",
    "checkpoint": "owner note",
    "conversation": "retire after report (Policy v3 section D)"
  }
}
